Symbol,Name,Last Sale,Net Change,% Change,Market Cap,Country,IPO Year,Volume,Sector,Industry
ITIC,Investors Title Company Common Stock,$194.48,0.00,0.00%,368825486.00,United States,,500,Finance,Specialty Insurers
ITOS,iTeos Therapeutics Inc. Common Stock,$34.1996,-0.9004,-2.565%,1214585559.00,United States,2020,154717,Consumer Durables,Specialty Chemicals
ITQ,Itiquira Acquisition Corp. Class A Ordinary Shares,$9.81,-0.001,-0.01%,282037500.00,United States,2021,6269,Finance,Business Services
ITQRW,Itiquira Acquisition Corp. Warrant,$0.31,0.01,3.333%,0.00,United States,2021,7101,Finance,Business Services
ITRI,Itron Inc. Common Stock,$50.745,-0.275,-0.539%,2285406117.00,United States,1993,148401,Capital Goods,Electrical Products
ITRM,Iterum Therapeutics plc Ordinary Share,$0.3047,-0.0129,-4.062%,55691628.00,Ireland,2018,2042153,Health Care,Biotechnology: Pharmaceutical Preparations
ITRN,Ituran Location and Control Ltd. Ordinary Shares,$22.28,-1.15,-4.908%,460915116.00,Israel,2005,33237,Technology,Electronic Components
IVA,Inventiva S.A. American Depository Shares,$11.1846,-0.0254,-0.227%,457154319.00,France,2020,454,Consumer Services,Other Consumer Services
IVAC,Intevac Inc. Common Stock,$5.25,0.08,1.547%,130461545.00,United States,1995,27614,,
IVCB,Investcorp Europe Acquisition Corp I Class A Ordinary Shares,$9.96,0.01,0.101%,429525000.00,Cayman Islands,2022,2933,,
IVCBU,Investcorp Europe Acquisition Corp I Unit,$10.055,-0.04,-0.396%,0.00,Cayman Islands,2021,845,,
IVCBW,Investcorp Europe Acquisition Corp I Warrant,$0.2702,0.1101,68.77%,0.00,Cayman Islands,2022,7774,,
IVCP,Swiftmerge Acquisition Corp. Class A Ordinary Share,$9.81,-0.01,-0.102%,277132500.00,Canada,2022,306,,
IVCPU,Swiftmerge Acquisition Corp. Unit,$9.95,-0.01,-0.10%,0.00,Canada,2021,100,,
IVCPW,Swiftmerge Acquisition Corp. Warrants,$0.18,-0.145,-44.615%,0.00,Canada,2022,505,,
IVDA,Iveda Solutions Inc. Common Stock,$3.09,0.91,41.743%,35725489.00,United States,,30883444,Miscellaneous,Diversified Manufacture
IVDAW,Iveda Solutions Inc. Warrant,$0.7501,0.1698,29.261%,0.00,United States,,106397,Miscellaneous,Diversified Manufacture
IXAQ,IX Acquisition Corp. Class A Ordinary Share,$9.81,-0.02,-0.203%,282037500.00,United Kingdom,2021,38088,,
IXAQU,IX Acquisition Corp. Unit,$9.89,0.00,0.00%,0.00,United Kingdom,2021,229,,
IXHL,Incannex Healthcare Limited American Depositary Shares,$7.90,-0.64,-7.494%,382479448.00,Australia,,122450,,
IZEA,IZEA Worldwide Inc. Common Stock,$1.475,0.035,2.431%,91710345.00,United States,,317636,Technology,Advertising
JACK,Jack In The Box Inc. Common Stock,$90.50,0.77,0.858%,1904436660.00,United States,,106309,Consumer Services,Restaurants
JAGX,Jaguar Health Inc. Common Stock,$0.55,-0.0299,-5.156%,42379695.00,United States,2015,1548505,Health Care,Biotechnology: Pharmaceutical Preparations
JAKK,JAKKS Pacific Inc. Common Stock,$13.32,0.09,0.68%,127471108.00,United States,1996,43731,Consumer Non-Durables,Recreational Products/Toys
JAMF,Jamf Holding Corp. Common Stock,$33.50,-0.27,-0.80%,4006043766.00,United States,2020,113441,Technology,Computer Software: Prepackaged Software
JAN,JanOne Inc. Common Stock (NV),$3.13,0.06,1.954%,8849793.00,United States,,14333,Public Utilities,Environmental Services
JANX,Janux Therapeutics Inc. Common Stock,$13.65,-0.43,-3.054%,568153431.00,United States,2021,27338,Health Care,Biotechnology: Pharmaceutical Preparations
JAQC,Jupiter Acquisition Corporation Common stock,$9.65,-0.025,-0.258%,195871348.00,United States,2021,1048,Consumer Durables,Consumer Electronics/Appliances
JAQCW,Jupiter Acquisition Corporation Warrants,$0.33,0.00,0.00%,0.00,United States,2021,500,Consumer Durables,Consumer Electronics/Appliances
JAZZ,Jazz Pharmaceuticals plc Common Stock (Ireland),$163.07,-2.63,-1.587%,10067752802.00,Ireland,2007,104485,Health Care,Biotechnology: Pharmaceutical Preparations
JBHT,J.B. Hunt Transport Services Inc. Common Stock,$170.63,-2.55,-1.472%,17890634672.00,United States,,479872,Transportation,Trucking Freight/Courier Services
JBLU,JetBlue Airways Corporation Common Stock,$12.09,0.19,1.597%,3878339349.00,United States,2002,5986988,Transportation,Air Freight/Delivery Services
JBSS,John B. Sanfilippo & Son Inc. Common Stock,$84.88,-0.15,-0.176%,978305490.00,United States,1991,20568,Consumer Non-Durables,Specialty Foods
JCIC,Jack Creek Investment Corp. Class A Ordinary Shares,$9.825,0.01,0.102%,423703125.00,United States,2021,84204,Finance,Business Services
JCICU,Jack Creek Investment Corp. Units,$9.90,0.02,0.202%,0.00,United States,2021,1300,Finance,Business Services
JCICW,Jack Creek Investment Corp. Warrants,$0.2201,-0.0287,-11.535%,0.00,United States,2021,200,Finance,Business Services
JCTCF,Jewett-Cameron Trading Company Common Shares,$6.4255,0.00,0.00%,22443256.00,United States,,39,,
JD,JD.com Inc. American Depositary Shares,$57.7219,1.1819,2.09%,90012458335.00,China,2014,5614392,Miscellaneous,Diversified Commercial Services
JFIN,Jiayin Group Inc. American Depositary Shares,$2.375,-0.035,-1.452%,128309375.00,China,2019,12637,Finance,Finance: Consumer Services
JFU,9F Inc. American Depositary Shares,$0.9898,-0.1602,-13.93%,228964174.00,China,2019,129866,Finance,Finance: Consumer Services
JG,Aurora Mobile Limited American Depositary Shares,$1.07,-0.04,-3.604%,126715561.00,China,2018,49098,Technology,EDP Services
JGGC,Jaguar Global Growth Corporation I Class A Ordinary Shares,$9.91,0.01,0.101%,303906670.00,United States,2022,11471,,
JGGCR,Jaguar Global Growth Corporation I Right,$0.18,0.04,28.571%,0.00,United States,2022,201000,,
JGGCU,Jaguar Global Growth Corporation I Unit,$10.09,0.00,0.00%,0.00,United States,2022,5,,
JGGCW,Jaguar Global Growth Corporation I Warrant,$0.16,0.00,0.00%,0.00,United States,2022,883533,,
JJSF,J & J Snack Foods Corp. Common Stock,$153.65,1.20,0.787%,2936200335.00,United States,1986,15809,Consumer Non-Durables,Specialty Foods
JKHY,Jack Henry & Associates Inc. Common Stock,$199.765,-0.765,-0.381%,14547892717.00,United States,1985,122543,Technology,Retail: Computer Software & Peripheral Equipment
JMAC,Maxpro Capital Acquisition Corp. Class A Common Stock,$10.02,0.01,0.10%,134543801.00,Taiwan,2021,140,Consumer Durables,Consumer Electronics/Appliances
JMACU,Maxpro Capital Acquisition Corp. Units,$10.20,0.00,0.00%,0.00,Taiwan,2021,27,Consumer Durables,Consumer Electronics/Appliances
JMACW,Maxpro Capital Acquisition Corp. Warrants,$0.2179,0.0009,0.415%,0.00,Taiwan,2021,8989,Consumer Durables,Consumer Electronics/Appliances
JNCE,Jounce Therapeutics Inc. Common Stock,$6.79,-0.55,-7.493%,350803232.00,United States,2017,66887,Health Care,Biotechnology: Pharmaceutical Preparations
JOAN,JOANN Inc. Common Stock,$10.545,0.245,2.379%,428065723.00,United States,2021,78334,Consumer Non-Durables,Department/Specialty Retail Stores
JOBS,51job Inc. American Depositary Shares,$60.56,-0.39,-0.64%,4083997377.00,China,2004,632161,Technology,Diversified Commercial Services
JOFF,JOFF Fintech Acquisition Corp. Class A Common Stock,$9.79,0.00,0.00%,506632500.00,United States,2021,287,Consumer Durables,Consumer Electronics/Appliances
JOFFU,JOFF Fintech Acquisition Corp. Unit,$9.88,0.046,0.468%,0.00,United States,2021,210,Consumer Durables,Consumer Electronics/Appliances
JOFFW,JOFF Fintech Acquisition Corp. Warrant,$0.251,0.0096,3.977%,0.00,United States,2021,16171,Consumer Durables,Consumer Electronics/Appliances
JOUT,Johnson Outdoors Inc. Class A Common Stock,$78.86,1.19,1.532%,800984569.00,United States,,10133,Consumer Non-Durables,Recreational Products/Toys
JRSH,Jerash Holdings (US) Inc. Common Stock,$6.25,0.24,3.993%,77089488.00,United States,2018,39329,Basic Industries,Industrial Specialties
JRVR,James River Group Holdings Ltd. Common Shares,$24.305,-0.165,-0.674%,910181272.00,Bermuda,2014,96781,Finance,Property-Casualty Insurers
JSM,Navient Corporation 6% Senior Notes due December 15 2043,$22.8564,-0.1936,-0.84%,0.00,United States,,2713,Finance,Finance: Consumer Services
JSPR,Jasper Therapeutics Inc. Common Stock,$3.15,-0.14,-4.255%,119302946.00,United States,2020,23559,Health Care,Biotechnology: Pharmaceutical Preparations
JSPRW,Japer Therapeutics Inc. Warrants,$0.2472,0.00,0.00%,0.00,United States,2020,10,Health Care,Biotechnology: Pharmaceutical Preparations
JUGG,Jaws Juggernaut Acquisition Corporation Class A Ordinary Share,$9.81,0.00,0.00%,338445000.00,United States,2021,4,,
JUGGW,Jaws Juggernaut Acquisition Corporation Warrant,$0.56,-0.0172,-2.98%,0.00,United States,2021,5249,,
JUPW,Jupiter Wellness Inc. Common Stock,$1.0303,-0.0297,-2.802%,22755629.00,United States,2020,65789,Health Care,Biotechnology: Pharmaceutical Preparations
JUPWW,Jupiter Wellness Inc. Warrant,$0.8282,0.0681,8.959%,0.00,United States,2020,2050,Health Care,Biotechnology: Pharmaceutical Preparations
JVA,Coffee Holding Co. Inc. Common Stock,$3.4017,-0.037,-1.076%,19418941.00,United States,2005,15882,Consumer Non-Durables,Specialty Foods
JWEL,Jowell Global Ltd. Ordinary Shares,$2.11,0.00,0.00%,53743502.00,China,2021,67118,Consumer Services,Other Consumer Services
JYNT,The Joint Corp. Common Stock,$33.60,-0.53,-1.553%,484571136.00,United States,2014,44254,,
JZXN,Jiuzi Holdings Inc. Ordinary Shares,$1.26,0.01,0.80%,26997823.00,China,2021,52763,Consumer Durables,Automotive Aftermarket
KACL,Kairous Acquisition Corp. Limited Ordinary Shares,$9.93,0.0031,0.031%,100751200.00,Malaysia,2022,1793,,
KACLR,Kairous Acquisition Corp. Limited Rights,$0.1948,0.0248,14.588%,0.00,Malaysia,2022,22208,,
KACLU,Kairous Acquisition Corp. Limited Unit,$10.16,0.11,1.095%,0.00,Malaysia,2021,2306,,
KACLW,Kairous Acquisition Corp. Limited Warrants,$0.1595,0.00,0.00%,0.00,Malaysia,2022,1087,,
KAII,Kismet Acquisition Two Corp. Class A Ordinary Shares,$9.79,-0.02,-0.204%,286357500.00,United States,2021,24363,Finance,Business Services
KAIIU,Kismet Acquisition Two Corp. Unit,$9.83,0.00,0.00%,0.00,United States,2021,3301,Finance,Business Services
KAIIW,Kismet Acquisition Two Corp. Warrant,$0.1957,-0.0811,-29.299%,0.00,United States,2021,602,Finance,Business Services
KAIR,Kairos Acquisition Corp. Class A Ordinary Shares,$9.83,0.00,0.00%,339135000.00,United States,2021,38,Finance,Business Services
KAIRU,Kairos Acquisition Corp. Unit,$9.90,0.00,0.00%,0.00,United States,2021,10010,Finance,Business Services
KAIRW,Kairos Acquisition Corp. Warrant,$0.1611,-0.0001,-0.062%,0.00,United States,2021,100,Finance,Business Services
KALA,Kala Pharmaceuticals Inc. Common Stock,$0.96,-0.07,-6.796%,53817470.00,United States,2017,260645,Health Care,Biotechnology: Pharmaceutical Preparations
KALU,Kaiser Aluminum Corporation Common Stock,$89.35,0.58,0.653%,1417548293.00,United States,,21570,Basic Industries,Aluminum
KALV,KalVista Pharmaceuticals Inc. Common Stock,$13.755,-0.435,-3.066%,337592486.00,United Kingdom,2015,39881,Health Care,Biotechnology: Pharmaceutical Preparations
KARO,Karooooo Ltd. Ordinary Shares,$29.66,-1.84,-5.841%,918009804.00,Singapore,2021,3898,Technology,Computer Software: Prepackaged Software
KAVL,Kaival Brands Innovations Group Inc. Common Stock,$1.32,0.01,0.763%,41104029.00,United States,,56868,Consumer Non-Durables,Farming/Seeds/Milling
KBAL,Kimball International Inc. Class B Common Stock,$7.93,-0.04,-0.502%,290324191.00,United States,,42506,Consumer Durables,Industrial Specialties
KBNT,Kubient Inc. Common Stock,$1.36,-0.01,-0.73%,19453090.00,United States,2020,22452,Technology,EDP Services
KBNTW,Kubient Inc. Warrant,$0.5176,0.0876,20.372%,0.00,United States,2020,100,Technology,EDP Services
KC,Kingsoft Cloud Holdings Limited American Depositary Shares,$5.22,0.08,1.556%,1268940877.00,China,2020,2197770,Technology,Computer Software: Prepackaged Software
KDNY,Chinook Therapeutics Inc. Common Stock,$15.17,-0.26,-1.685%,833607868.00,United States,2015,153799,Health Care,Biotechnology: Pharmaceutical Preparations
KDP,Keurig Dr Pepper Inc. Common Stock,$37.79,0.14,0.372%,53592204538.00,United States,,1792047,Consumer Non-Durables,Beverages (Production/Distribution)
KE,Kimball Electronics Inc. Common Stock,$17.64,-0.10,-0.564%,442917309.00,United States,,18630,Capital Goods,Industrial Machinery/Components
KELYA,Kelly Services Inc. Class A Common Stock,$20.935,-0.015,-0.072%,824835881.00,United States,,57190,Technology,Diversified Commercial Services
KELYB,Kelly Services Inc. Class B Common Stock,$21.15,0.00,0.00%,833306849.00,United States,,102,Technology,Diversified Commercial Services
KEQU,Kewaunee Scientific Corporation Common Stock,$14.4968,0.00,0.00%,40444231.00,United States,,78,Capital Goods,Medical Specialities
KERN,Akerna Corp. Common Stock,$0.9509,-0.0591,-5.851%,13368424.00,United States,2018,322553,Health Care,Managed Health Care
KERNW,Akerna Corp Warrant,$0.15,0.0011,0.739%,0.00,United States,2018,13597,Health Care,Managed Health Care
KFFB,Kentucky First Federal Bancorp Common Stock,$7.42,0.045,0.61%,60979155.00,United States,,1176,Finance,Savings Institutions
KFRC,Kforce Inc. Common Stock,$72.63,-0.30,-0.411%,1552235940.00,United States,1995,22164,Technology,Diversified Commercial Services
KHC,The Kraft Heinz Company Common Stock,$41.4177,0.4777,1.167%,50732298105.00,United States,,3634064,Consumer Non-Durables,Farming/Seeds/Milling
KIDS,OrthoPediatrics Corp. Common Stock,$51.25,-0.41,-0.794%,1024725249.00,United States,2017,41724,Health Care,Medical/Dental Instruments
KIII,Kismet Acquisition Three Corp. Class A Ordinary Shares,$9.805,0.025,0.256%,357269688.00,United States,2021,6898,Finance,Business Services
KIIIU,Kismet Acquisition Three Corp. Unit,$9.812,-0.013,-0.132%,0.00,United States,2021,4575,Finance,Business Services
KIIIW,Kismet Acquisition Three Corp. Warrant,$0.20,0.00,0.00%,0.00,United States,2021,500,Finance,Business Services
KINS,Kingstone Companies Inc. Common Stock,$4.9928,-0.0072,-0.144%,53110780.00,United States,,1029,Finance,Specialty Insurers
KINZ,KINS Technology Group Inc. Class A Common Stock,$10.065,0.005,0.05%,347242500.00,United States,2021,101613,Consumer Durables,Consumer Electronics/Appliances
KINZW,KINS Technology Group Inc. Warrant,$0.1499,0.00,0.00%,0.00,United States,2021,1,Consumer Durables,Consumer Electronics/Appliances
KIRK,Kirkland's Inc. COMMONSTOCK,$8.50,0.04,0.473%,104816450.00,United States,2002,105218,Miscellaneous,Diversified Commercial Services
KLAC,KLA Corporation Common Stock,$336.52,-4.69,-1.375%,50718727226.00,United States,1980,529861,Capital Goods,Electronic Components
KLAQ,KL Acquisition Corp Class A Common Stock,$9.83,0.03,0.306%,353265625.00,United States,2021,1038,Consumer Durables,Consumer Electronics/Appliances
KLAQU,KL Acquisition Corp Unit,$9.90,0.00,0.00%,0.00,United States,2021,32,Consumer Durables,Consumer Electronics/Appliances
KLAQW,KL Acquisition Corp Warrant,$0.2572,0.0569,28.407%,0.00,United States,2021,6604,Consumer Durables,Consumer Electronics/Appliances
KLDO,Kaleido Biosciences Inc. Common Stock,$0.1954,-0.0745,-27.603%,8328448.00,United States,2019,10581222,Health Care,Biotechnology: Biological Products (No Diagnostic Substances)
KLIC,Kulicke and Soffa Industries Inc. Common Stock,$51.2368,-1.0932,-2.089%,3192074569.00,Singapore,,225881,Technology,Semiconductors
KLTR,Kaltura Inc. Common Stock,$1.635,-0.025,-1.506%,207751618.00,United States,2021,161159,Technology,EDP Services
KLXE,KLX Energy Services Holdings Inc. Common Stock,$5.12,-0.20,-3.759%,53651901.00,United States,,119161,Energy,Oilfield Services/Equipment
KMDA,Kamada Ltd. Ordinary Shares,$5.6646,-0.1054,-1.827%,253776935.00,Israel,2013,6290,Health Care,Biotechnology: Pharmaceutical Preparations
KMPH,KemPharm Inc. Common Stock,$4.49,-0.28,-5.87%,154557038.00,United States,,331952,Health Care,Biotechnology: Pharmaceutical Preparations
KNBE,KnowBe4 Inc. Class A Common Stock,$23.655,0.565,2.447%,4135107084.00,United States,2021,217847,Technology,Computer Software: Prepackaged Software
KNDI,Kandi Technologies Group Inc Common Stock,$2.72,-0.05,-1.805%,207417258.00,China,,320957,Capital Goods,Auto Parts:O.E.M.
KNSA,Kiniksa Pharmaceuticals Ltd. Class A Common Stock,$11.12,-0.29,-2.542%,768441139.00,United States,2018,164664,Health Care,Biotechnology: Pharmaceutical Preparations
KNTE,Kinnate Biopharma Inc. Common Stock,$9.19,-0.84,-8.375%,403893920.00,United States,2020,37577,Health Care,Biotechnology: Pharmaceutical Preparations
KNTK,Kinetik Holdings Inc. Class A Common Stock,$67.77,-1.50,-2.165%,1280613094.00,United States,2017,33010,Energy,Oil & Gas Production
KOD,Kodiak Sciences Inc Common Stock,$7.095,-0.115,-1.595%,368475278.00,United States,2018,421045,Health Care,Biotechnology: Pharmaceutical Preparations
KOPN,Kopin Corporation Common Stock,$2.1153,-0.0347,-1.614%,195116416.00,United States,1992,437902,Capital Goods,Industrial Machinery/Components
KOSS,Koss Corporation Common Stock,$7.59,0.05,0.663%,69431764.00,United States,,32737,Consumer Non-Durables,Consumer Electronics/Appliances
KPLT,Katapult Holdings Inc. Common Stock,$2.025,-0.025,-1.22%,198705174.00,United States,2019,255657,Technology,EDP Services
KPLTW,Katapult Holdings Inc. Warrant,$0.30,0.0002,0.067%,0.00,United States,2019,1115,Technology,EDP Services
KPRX,Kiora Pharmaceuticals Inc.  Common Stock,$0.5627,-0.0654,-10.412%,7119873.00,United States,,176493,Health Care,Biotechnology: In Vitro & In Vivo Diagnostic Substances
KPTI,Karyopharm Therapeutics Inc. Common Stock,$7.795,-0.305,-3.765%,617052325.00,United States,2013,654823,Miscellaneous,Diversified Commercial Services
KRBP,Kiromic BioPharma Inc. Common Stock,$0.8457,0.0058,0.691%,13180731.00,United States,2020,5745,Consumer Durables,Specialty Chemicals
KRKR,36Kr Holdings Inc. American Depositary Shares,$1.045,-0.055,-5.00%,40289759.00,China,2019,32534,Miscellaneous,Business Services
KRMD,Repro Med Systems Inc. Common Stock,$2.98,-0.03,-0.997%,133120057.00,United States,,1174,Health Care,Medical/Dental Instruments
KRNL,Kernel Group Holdings Inc. Class A Ordinary Shares,$9.81,0.00,0.00%,373699688.00,United States,2021,908,Finance,Business Services
KRNLW,Kernel Group Holdings Inc. Warrants,$0.2997,-0.0402,-11.827%,0.00,United States,2021,4900,Finance,Business Services
KRNT,Kornit Digital Ltd. Ordinary Shares,$73.54,0.66,0.906%,3653802101.00,Israel,2015,174588,Capital Goods,Industrial Machinery/Components
KRNY,Kearny Financial Corp Common Stock,$12.35,-0.02,-0.162%,898500044.00,United States,,85495,Finance,Savings Institutions
KRON,Kronos Bio Inc. Common Stock,$6.42,-0.60,-8.547%,363384615.00,United States,2020,73083,Consumer Durables,Specialty Chemicals
KROS,Keros Therapeutics Inc. Common Stock,$62.00,-3.05,-4.689%,1488028086.00,United States,2020,71839,Consumer Durables,Specialty Chemicals
KRT,Karat Packaging Inc. Common Stock,$17.9825,-0.3675,-2.003%,356222967.00,United States,2021,1290,Capital Goods,Office Equipment/Supplies/Services
KRTX,Karuna Therapeutics Inc. Common Stock,$132.64,-2.81,-2.075%,3953770392.00,United States,2019,86029,Health Care,Biotechnology: Pharmaceutical Preparations
KRUS,Kura Sushi USA Inc. Class A Common Stock,$51.275,-0.375,-0.726%,497965828.00,United States,2019,19693,Consumer Services,Restaurants
KRYS,Krystal Biotech Inc. Common Stock,$67.485,-0.515,-0.757%,1701167616.00,United States,2017,46806,Health Care,Biotechnology: Biological Products (No Diagnostic Substances)
KSCP,Knightscope Inc. Class A Common Stock,$4.1501,0.1101,2.725%,98614240.00,United States,2022,202387,Miscellaneous,Diversified Manufacture
KSI,Kadem Sustainable Impact Corporation Class A common stock,$9.76,-0.01,-0.102%,213500000.00,United States,2021,11000,Consumer Durables,Consumer Electronics/Appliances
KSICW,Kadem Sustainable Impact Corporation Warrant,$0.25,0.0004,0.16%,0.00,United States,2021,200,Consumer Durables,Consumer Electronics/Appliances
KSPN,Kaspien Holdings Inc. Common Stock,$7.435,-0.285,-3.692%,18532243.00,United States,,3395,Technology,Retail: Computer Software & Peripheral Equipment
KTCC,Key Tronic Corporation Common Stock,$5.60,-0.05,-0.885%,60266478.00,United States,1983,1304,Technology,Computer peripheral equipment
KTOS,Kratos Defense & Security Solutions Inc. Common Stock,$19.43,0.02,0.103%,2421816210.00,United States,,371332,Consumer Non-Durables,Ordnance And Accessories
KTRA,Kintara Therapeutics Inc. Common Stock,$0.3351,-0.0326,-8.866%,16439092.00,United States,,244356,Health Care,Biotechnology: Pharmaceutical Preparations
KTTA,Pasithea Therapeutics Corp. Common Stock,$1.2471,0.0071,0.573%,28506674.00,United States,2021,498137,Health Care,Biotechnology: Pharmaceutical Preparations
KTTAW,Pasithea Therapeutics Corp. Warrant,$0.17,0.00,0.00%,0.00,United States,2021,904,Health Care,Biotechnology: Pharmaceutical Preparations
KURA,Kura Oncology Inc. Common Stock,$15.5617,-0.6883,-4.236%,1036631426.00,United States,,135381,Health Care,Biotechnology: Biological Products (No Diagnostic Substances)
KVHI,KVH Industries Inc. Common Stock,$8.82,0.05,0.57%,166492185.00,United States,1996,36990,Technology,Radio And Television Broadcasting And Communications Equipment
KVSA,Khosla Ventures Acquisition Co. Class A Common Stock,$9.78,0.00,0.00%,395992200.00,United States,2021,7686,Consumer Durables,Consumer Electronics/Appliances
KVSC,Khosla Ventures Acquisition Co. III Class A Common Stock,$9.77,-0.005,-0.051%,613134200.00,United States,2021,1176702,Consumer Durables,Consumer Electronics/Appliances
KXIN,Kaixin Auto Holdings Ordinary Shares,$1.02,-0.04,-3.774%,146329705.00,China,2017,206979,Finance,Business Services
KYCHR,Keyarch Acquisition Corporation Rights,$0.16,0.01,6.667%,0.00,United States,2022,57300,,
KYCHU,Keyarch Acquisition Corporation Unit,$10.14,0.19,1.91%,0.00,United States,2022,635,,
KYMR,Kymera Therapeutics Inc. Common Stock,$34.52,-1.11,-3.115%,1784806339.00,United States,2020,639994,Consumer Durables,Specialty Chemicals
KZIA,Kazia Therapeutics Limited American Depositary Shares,$8.24,-0.14,-1.671%,108798653.00,Australia,,7579,Health Care,Biotechnology: Pharmaceutical Preparations
KZR,Kezar Life Sciences Inc. Common Stock,$15.60,-0.76,-4.645%,884718370.00,United States,2018,317595,Health Care,Biotechnology: Pharmaceutical Preparations
LAAAW,Lakeshore Acquisition I Corp. Warrant,$0.3299,-0.0001,-0.03%,0.00,China,2021,500,,
LAB,Standard BioTools Inc. Common Stock,$3.82,0.02,0.526%,294898564.00,United States,2011,485468,Capital Goods,Biotechnology: Laboratory Analytical Instruments
LABP,Landos Biopharma Inc. Common Stock,$1.2597,-0.0803,-5.993%,50709085.00,United States,2021,36595,Consumer Durables,Specialty Chemicals
LAKE,Lakeland Industries Inc. Common Stock,$19.20,-0.28,-1.437%,149287795.00,United States,1986,3691,,
LAMR,Lamar Advertising Company Class A Common Stock,$113.18,-0.19,-0.168%,11462067501.00,United States,1996,164390,Consumer Services,Real Estate Investment Trusts
LANC,Lancaster Colony Corporation Common Stock,$155.51,-0.12,-0.077%,4281967850.00,United States,,20938,Consumer Non-Durables,Packaged Foods
LAND,Gladstone Land Corporation Common Stock,$38.1556,-2.2044,-5.462%,1317133907.00,United States,1993,335097,Consumer Services,Real Estate Investment Trusts
LANDM,Gladstone Land Corporation 5.00% Series D Cumulative Term Preferred Stock,$25.50,-0.05,-0.196%,614611353.00,United States,,1508,Consumer Services,Real Estate Investment Trusts
LANDO,Gladstone Land Corporation 6.00% Series B Cumulative Redeemable Preferred Stock,$26.00,-0.01,-0.038%,0.00,United States,,8836,Consumer Services,Real Estate Investment Trusts
LARK,Landmark Bancorp Inc. Common Stock,$26.2448,-0.5052,-1.889%,131157312.00,United States,,757,Finance,Major Banks
LASR,nLIGHT Inc. Common Stock,$15.70,0.20,1.29%,696084887.00,United States,2018,79247,Technology,Semiconductors
LATGW,LatAmGrowth SPAC Warrants,$0.27,0.02,8.00%,0.00,Mexico,2022,2100,,
LAUR,Laureate Education Inc. Common Stock,$11.565,-0.025,-0.216%,2064393116.00,United States,2017,311347,Miscellaneous,Service to the Health Industry
LAWS,Lawson Products Inc. Common Stock,$34.79,-0.78,-2.193%,317131167.00,United States,,15506,Capital Goods,Industrial Machinery/Components
LAX,8i Acquisition 2 Corp. Ordinary Shares,$9.85,0.00,0.00%,109073975.00,Singapore,2021,6,,
LAXXW,8i Acquisition 2 Corp. Warrant,$0.499,0.178,55.452%,0.00,Singapore,2021,1000,,
LAZR,Luminar Technologies Inc.  Class A Common Stock,$13.87,0.20,1.463%,4845361640.00,United States,2019,1713237,Capital Goods,Auto Parts:O.E.M.
LAZY,Lazydays Holdings Inc. Common Stock,$20.06,0.39,1.983%,275783516.00,United States,,99016,Consumer Services,Other Specialty Stores
LBAI,Lakeland Bancorp Inc. Common Stock,$15.8396,0.1096,0.697%,1026083079.00,United States,,38170,Finance,Major Banks
LBBBU,Lakeshore Acquisition II Corp. Unit,$9.99,0.00,0.00%,0.00,United States,2022,30,,
LBC,Luther Burbank Corporation Common Stock,$13.09,0.11,0.847%,676084075.00,United States,2003,32789,Finance,Commercial Banks
LBPH,Longboard Pharmaceuticals Inc. Common Stock,$5.14,0.05,0.982%,88486899.00,United States,2021,875,Health Care,Biotechnology: Pharmaceutical Preparations
LBPS,4D pharma plc American Depositary Shares,$3.8417,0.1117,2.995%,86582775.00,United Kingdom,,53507,Health Care,Biotechnology: Pharmaceutical Preparations
LBPSW,4D pharma plc Warrant,$0.318,0.00,0.00%,0.00,United Kingdom,,85,Health Care,Biotechnology: Pharmaceutical Preparations
LBRDA,Liberty Broadband Corporation Class A Common Stock,$136.27,2.26,1.686%,22876024412.00,United States,,54715,Consumer Services,Telecommunications Equipment
LBRDK,Liberty Broadband Corporation Class C Common Stock,$141.27,2.26,1.626%,23715388337.00,United States,,318811,Consumer Services,Telecommunications Equipment
LBRDP,Liberty Broadband Corporation Series A Cumulative Redeemable Preferred Stock,$27.00,-0.03,-0.111%,0.00,United States,,1407,Consumer Services,Telecommunications Equipment
LBTYA,Liberty Global plc Class A Ordinary Shares,$25.53,0.07,0.275%,13348893924.00,United Kingdom,,468565,Consumer Services,Television Services
